{
  "$schema": "https://json-schema.org/draft/2020-12/schema",
  "$id": "https://raw.githubusercontent.com/tnunamak/clawmeter/main/docs/schemas/status-v1.schema.json",
  "title": "Clawmeter status v1",
  "type": "object",
  "required": ["schema_version", "providers"],
  "properties": {
    "schema_version": { "const": 1 },
    "fetched_at": { "type": "string", "format": "date-time" },
    "providers": { "type": "object", "additionalProperties": { "$ref": "#/$defs/provider" } },
    "cache": {
      "type": "object",
      "required": ["hit"],
      "properties": {
        "hit": { "type": "boolean" },
        "fetched_at": { "type": "string", "format": "date-time" }
      },
      "additionalProperties": true
    },
    "view": { "$ref": "#/$defs/view" }
  },
  "additionalProperties": true,
  "$defs": {
    "provider": {
      "type": "object",
      "required": ["maturity"],
      "properties": {
        "maturity": {
          "type": "object",
          "required": ["experimental"],
          "properties": {
            "experimental": { "type": "boolean" },
            "learn_more": { "type": "string", "format": "uri" }
          },
          "additionalProperties": true
        },
        "usage": { "$ref": "#/$defs/usage" },
        "sources": {
          "type": "array",
          "items": { "$ref": "#/$defs/source" }
        },
        "forecast": {
          "type": "object",
          "required": ["windows"],
          "properties": {
            "windows": {
              "type": "object",
              "additionalProperties": {
                "type": "object",
                "required": ["projected_pct", "indicator"],
                "properties": {
                  "projected_pct": { "type": "number" },
                  "indicator": { "type": "string" }
                },
                "additionalProperties": true
              }
            }
          },
          "additionalProperties": true
        },
        "status": { "type": "object" },
        "view": { "$ref": "#/$defs/account_view" }
      },
      "additionalProperties": true
    },
    "source": {
      "type": "object",
      "required": ["source"],
      "properties": {
        "source": {
          "type": "object",
          "required": ["id"],
          "properties": { "id": { "type": "string" }, "label": { "type": "string" } },
          "additionalProperties": false
        },
        "usage": { "$ref": "#/$defs/usage" },
        "forecast": { "$ref": "#/$defs/provider/properties/forecast" },
        "status": { "type": "object" },
        "view": { "$ref": "#/$defs/account_view" }
      },
      "additionalProperties": true
    },
    "usage": {
      "type": "object",
      "required": ["provider", "fetched_at", "windows"],
      "properties": {
        "provider": { "type": "string" },
        "source_id": { "type": "string" },
        "source_label": { "type": "string" },
        "fetched_at": { "type": "string", "format": "date-time" },
        "windows": {
          "type": ["array", "null"],
          "items": {
            "type": "object",
            "required": ["name", "utilization", "resets_at"],
            "properties": {
              "name": { "type": "string" },
              "display_name": { "type": "string" },
              "utilization": { "type": "number" },
              "resets_at": { "type": "string", "format": "date-time" },
              "reset_policy": { "type": "string" }
            },
            "additionalProperties": true
          }
        },
        "error": { "type": "string" },
        "stale": { "type": "boolean" },
        "warning": { "type": "string" },
        "is_expired": { "type": "boolean" },
        "reset_credits": {
          "type": "object",
          "required": ["available_count"],
          "properties": {
            "available_count": { "type": "integer", "minimum": 0 },
            "fetched_at": { "type": "string", "format": "date-time" }
          },
          "additionalProperties": true
        }
      },
      "additionalProperties": true
    },
    "view": {
      "description": "Added in v1 as an optional field. The snapshot the output was built from: one clock, the account order, and the most at-risk window.",
      "type": "object",
      "required": ["at"],
      "properties": {
        "at": { "type": "string", "format": "date-time" },
        "accounts": {
          "type": "array",
          "description": "Source keys in snapshot display order.",
          "items": { "type": "string" }
        },
        "worst": {
          "type": "object",
          "required": ["account", "window"],
          "properties": {
            "account": { "type": "string" },
            "window": { "type": "string" }
          },
          "additionalProperties": true
        }
      },
      "additionalProperties": true
    },
    "account_view": {
      "description": "One source's snapshot. Keys are absent when their value is unknown; they are never zero.",
      "type": "object",
      "required": ["reading", "windows"],
      "properties": {
        "reading": {
          "type": "object",
          "required": ["state"],
          "properties": {
            "state": { "enum": ["fresh", "stale", "error", "expired", "unavailable"] },
            "observed_at": { "type": "string", "format": "date-time" },
            "reason": { "type": "string" }
          },
          "additionalProperties": true
        },
        "windows": {
          "type": "array",
          "items": { "$ref": "#/$defs/window_view" }
        }
      },
      "additionalProperties": true
    },
    "window_view": {
      "type": "object",
      "required": ["name", "used", "shown", "forecast", "exhaustion", "reset"],
      "properties": {
        "name": { "type": "string" },
        "code": { "type": "string" },
        "label": { "type": "string" },
        "used": { "type": "number" },
        "shown": { "type": "boolean", "description": "Whether list surfaces show this window to people." },
        "forecast": {
          "type": "object",
          "required": ["state"],
          "properties": {
            "state": { "enum": ["known", "warming", "stale", "none"] },
            "pct": { "type": "number" }
          },
          "if": { "properties": { "state": { "const": "known" } }, "required": ["state"] },
          "then": { "required": ["pct"] },
          "else": { "not": { "required": ["pct"] } },
          "additionalProperties": true
        },
        "exhaustion": {
          "type": "object",
          "required": ["state"],
          "properties": {
            "state": { "enum": ["out", "runs_out", "lasts", "unknown"] },
            "runs_out_in_seconds": { "type": "integer", "minimum": 0 },
            "early_by_seconds": { "type": "integer", "minimum": 0 },
            "out_since": { "type": "string", "format": "date-time" }
          },
          "if": { "properties": { "state": { "const": "runs_out" } }, "required": ["state"] },
          "then": { "required": ["runs_out_in_seconds"] },
          "else": { "not": { "required": ["runs_out_in_seconds"] } },
          "additionalProperties": true
        },
        "reset": {
          "type": "object",
          "required": ["known"],
          "properties": {
            "known": { "type": "boolean" },
            "at": { "type": "string", "format": "date-time" },
            "policy": { "type": "string" }
          },
          "if": { "properties": { "known": { "const": true } }, "required": ["known"] },
          "then": { "required": ["at"] },
          "else": { "not": { "required": ["at"] } },
          "additionalProperties": true
        }
      },
      "additionalProperties": true
    }
  }
}
